<?xml version="1.0" encoding="UTF-8"?>
<!-- play group:0, enemyGroup :1 -->
<root
    xmlns:xsi='http://www.w3.org/2001/XMLSchema-instance'
    xmlns='http://fighter.huliqing.name'
    xsi:schemaLocation='http://fighter.huliqing.name meta/actor.xsd'>
    
    <!--==========================================================================-->
    <!--Debug test-->
    <!--==========================================================================-->
    
    <!--test-->
    <!-- player test -->    
    <actor id="actorPlayerTest" extends="actorPlayer"
           items="itemMapWorld,item000|100,itemGold|10000,itemTowerSnow|100,itemScrollLife|10
,itemDetoxifyGrass|100,itemTonicRed|5,itemTonicBlue|5,itemHerb|100,itemASTonic|100
,itemTowerStone|100,itemTower|100,itemSpiderSpawn|100
,itemScrollBear|100,itemScrollWolf|100,itemScrollScorpion|100,itemScrollRaptor|100,itemScrollTrex|100
,itemBook005,itemBook006,itemBook007,itemBook008,itemBook010
" 
           talents="talentLifeRestore,talentManaRestore,talentDefence,talentMagicDefence,talentAttack,talentMagicAttack,talentVision,talentMoveSpeed"
           talentPoints="100"
           skins="weaponSword000,weaponSword000L,weaponSword001,weaponSword001L,weaponSword002,weaponSword002L,weaponSword003,weaponSword003L
,weaponBow000,weaponBow001,weaponWand000
,skinHair001,skinHair006,skinHair010,skinHair011,skinBlinder001|12,skinMouthmask001|13,skinHorn001|14
,skinFoot001,skinLowerBody001,skinUpperBody001,skinHand001
,skinFoot002,skinLowerBody002,skinUpperBody002,skinHand002
,skinFoot004,skinLowerBody004,skinUpperBody004,skinHand004
,skinFoot005,skinLowerBody005,skinUpperBody005,skinHand005
,skinFoot006,skinHand006,skinUpperBody006
"
           skinWeapon="weaponSword000,weaponSword000L"
           skills="skillDualSwordWave,skillBowShot,skillIceShot
,skillShotLight,skillShotAddLife,skillShotReborn,skillShotWindWalk,skillShotCleanBuff
,skillDualSwordAttack
,skillWait,skillWalk,skillRun,skillReset,skillDead,skillHurtFront,skillHurtBack
,skillDefend1,skillDefend2
,skillDuckLeft,skillDuckRight,skillDuckBack,skillDuckLeftRoll,skillDuckRightRoll
,skillAttack,skillAttack2,skillAttack3" 
    />
    
    <actor id="actorSinbadTest" extends="actorSinbad" />
    <actor id="actorSkeletonTest" extends="actorPlayer" />
    
    <!--==========================================================================-->
    <!--角色基类-->
    <!--==========================================================================-->
    
    <!--所有角色基类-->
    <actor id="actorBase" channels="channelFull" chat="chatSimple" 
           modules="moduleActor,moduleAction,moduleAttribute,moduleChannel,moduleChat,moduleItem,moduleLogic
    ,moduleResist,moduleSkill,moduleSkin,moduleState,moduleTalent,moduleTask,moduleLevel,moduleDrop"
    />
    
    <!--未分类生物：有生命现象、种族未知、性别未知的角色, 如: 未分类人物、动物、野兽、怪物等 -->
    <actor id="actorLiveBase" extends="actorBase" attributes="attributeActorLiving"
           modules="moduleActor,moduleAction,moduleAttribute,moduleChannel,moduleChat,moduleItem,moduleLogic
    ,moduleResist,moduleSkill,moduleSkin,moduleState,moduleTalent,moduleTask,moduleLevel,moduleDrop"
           logics="logicSearchEnemy,logicDynamicFight,logicPatrol,logicFollow,logicDefend"
           />
    
    <!--未分类静物：无生命迹象、种族未知、性别未知的角色， 如: 炮塔、宝箱、祭坛、房屋等-->
    <actor id="actorNonLiveBase" extends="actorBase" attributes="attributeActorUnliving"
           modules="moduleActor,moduleAction,moduleAttribute,moduleChannel,moduleChat,moduleItem,moduleLogic
    ,moduleResist,moduleSkill,moduleSkin,moduleState,moduleTask,moduleLevel,moduleDrop"
           logics="logicSearchEnemy,logicStaticFight"
           resist="resistNonLife"
           />

    <!--种族配置： 人类女性-->
    <actor id="actorHumanFemaleBase" extends="actorBase" attributes="attributeHumanFemale"
            modules="moduleActor,moduleAction,moduleAttribute,moduleChannel,moduleChat,moduleItem,moduleLogic
    ,moduleResist,moduleSkill,moduleSkin,moduleState,moduleTalent,moduleTask,moduleLevel,moduleDrop"
            logics="logicSearchEnemy,logicDynamicFight,logicPatrol,logicFollow,logicDefend"
            channels="channelLowerBody,channelUpperBody,channelLeftHand,channelRightHand,channelHead"
            resist="resistHuman"
            file="Models/actor/ske.mesh.j3o"
            icon="Interface/face/female1.jpg"
            extAnim="Models/actor/ext_anim" 
            skinBase="skinEar000,skinEye000,skinFace000,skinFoot000,skinHair010,skinHand000,skinLowerBody000,skinUpperBody000"
            skins="skinLowerBody002|1,weaponSword000"
            skinOutfit="skinFoot003,skinHand003,skinLowerBody003,skinUpperBody003"
            skinWeapon="weaponSword000"
            skills="skillWait,skillWalk,skillRun,skillReset,skillDead,skillHurtFront,skillHurtBack
,skillDefend1,skillDefend2
,skillDuckLeft,skillDuckRight,skillDuckBack,skillDuckLeftRoll,skillDuckRightRoll
,skillAttack,skillAttack2,skillAttack3
,skillBowShot
,skillDualSwordAttack"

            scale="0.2" mass="60" group="1" mat="4"
           />
           
    <!--种族配置： 人类男性（暂无）-->
    <!--种族配置： 兽人女性（暂无）-->
    <!--种族配置： 兽人男性（暂无）-->
    
    <!--==========================================================================-->
    <!--种族类角色配置: 人类-女性-->
    <!--==========================================================================-->
    
<!--    人类种族、女性基本配置
    <actor id="actorHumanFemaleBase" extends="actorLiveBase" file="Models/actor/ske.mesh.j3o" sex="0" race="1"
            icon="Interface/face/female1.jpg"
            scale="0.2" mass="60" group="1" mat="4" level="1" resist="resistHuman"
            channels="channelLowerBody,channelUpperBody,channelLeftHand,channelRightHand,channelHead"
            extAnim="Models/actor/ext_anim" 
            skinBase="skinEar000,skinEye000,skinFace000,skinFoot000,skinHair010,skinHand000,skinLowerBody000,skinUpperBody000"
            skins="skinLowerBody002|1,weaponSword000"
            skinOutfit="skinFoot003,skinHand003,skinLowerBody003,skinUpperBody003"
            skinWeapon="weaponSword000" 
            slots="slotSwordLeftBack,slotSwordLeftBack2,slotSwordLeftWaist,slotSwordLeftWaist2,slotBowLeftBack,slotWandLeftBack"
            items="itemTonicRed|5,itemTonicBlue|5,itemSpiderSpawn|1,itemTower|1" 
            skills="skillWait,skillWalk,skillRun,skillReset,skillDead,skillHurtFront,skillHurtBack
,skillDefend1,skillDefend2
,skillDuckLeft,skillDuckRight,skillDuckBack,skillDuckLeftRoll,skillDuckRightRoll
,skillAttack,skillAttack2,skillAttack3
,skillBowShot
,skillDualSwordAttack"
            />-->
    
    <!-- player-->
    <actor id="actorPlayer" extends="actorHumanFemaleBase" skinWeapon="weaponBow000" 
           logics="logicSearchEnemyForPlayer,logicPlayer" 
           talents="talentLifeRestore,talentDefence,talentAttack"
           items="itemTonicRed|5,itemTonicBlue|5,itemSpiderSpawn|1,itemTower|1" 
    />
    
    
    <!--战士-->
    <actor id="actorWarrior" extends="actorHumanFemaleBase" icon="Interface/face/female1.jpg"
           logics="logicSearchEnemyForPlayer,logicPlayer"
           talents="talentLifeRestore,talentDefence,talentAttack"
           skinOutfit="skinFoot005,skinHand005,skinLowerBody005,skinUpperBody005"
           items="itemTonicRed|10,itemTonicBlue|5,itemTower|1" 
           skins="weaponSword002L"
           skinWeapon="weaponSword001" 
           skills="skillWait,skillWalk,skillRun,skillReset,skillDead,skillHurtFront,skillHurtBack
,skillAttack,skillAttack2,skillAttack3,skillDualSwordAttack,skillBowShot
,skillDanceSakura,skillDualSwordWave
,skillDefend1,skillDefend2
,skillDuckLeft,skillDuckRight,skillDuckBack,skillDuckLeftRoll,skillDuckRightRoll
" />
    
    <!--牧师-->
    <actor id="actorPastor" extends="actorHumanFemaleBase" icon="Interface/face/female2.jpg"
           logics="logicSearchEnemyForPlayer,logicPlayer"
           talents="talentManaRestore,talentMagicDefence,talentMagicAttack"
           items="itemTonicRed|5,itemTonicBlue|10" 
           skinBase="skinEar000,skinEye000,skinFace000,skinFoot000,skinHair006,skinHand000,skinLowerBody000,skinUpperBody000"
           skinOutfit="skinFoot006,skinHand006,skinUpperBody006"
           skinWeapon="weaponWand000" 
           skills="skillWait,skillWalk,skillRun,skillReset,skillDead,skillHurtFront,skillHurtBack
,skillAttack,skillAttack2,skillAttack3,skillDualSwordAttack,skillBowShot
,skillShotLight,skillShotAddLife,skillShotReborn,skillShotWindWalk,skillShotCleanBuff
" />
    
    <!--猎人-->
    <actor id="actorHunter" extends="actorHumanFemaleBase" icon="Interface/face/female3.jpg"
           logics="logicSearchEnemyForPlayer,logicPlayer"
           talents="talentAttack,talentDefence,talentVision,talentMoveSpeed"
           items="itemTonicRed|10,itemTonicBlue|5,itemHerb|5,itemTowerStone|1" 
           skinBase="skinEar000,skinEye000,skinFace000,skinFoot000,skinHair011,skinHand000,skinLowerBody000,skinUpperBody000"
           skins="weaponSword000"
           skinOutfit="skinFoot003,skinHand003,skinUpperBody003,skinLowerBody003,skinMouthmask001"
           skinWeapon="weaponBow001" 
           skills="skillWait,skillWalk,skillRun,skillReset,skillDead,skillHurtFront,skillHurtBack
,skillAttack,skillAttack2,skillAttack3,skillDualSwordAttack,skillBowShot
,skillSummon,skillLightningShot,skillIceShot
" />
    
    <!-- hard -->
    <actor id="actorHard" extends="actorHumanFemaleBase"  
           skinOutfit="skinFoot001,skinHand001,skinLowerBody001,skinUpperBody001,skinHair006"
           skills="skillWait,skillWalk,skillRun,skillReset,skillDead,skillHurtFront,skillHurtBack
,skillDefend1,skillDefend2
,skillDuckLeft,skillDuckRight,skillDuckBack,skillDuckLeftRoll,skillDuckRightRoll
,skillAttack,skillAttack2,skillAttack3
,skillBowShot
,skillDualSwordAttack
,skillDanceSakura,skillLightningShot
"
    />